hidden_insight,evidence,business_meaning,action
"Nhu cầu có dấu hiệu thật, nhưng chưa phải nhu cầu trả phí mạnh.","131/159 kỳ vọng chơi thường xuyên hơn, nhưng chỉ 20/159 trả lời chắc chắn sẵn sàng trả phí.",Không nên bắt đầu bằng subscription rộng; cần gắn phí với giao dịch có giá trị rõ như đặt sân hoặc tham gia trận.,Ưu tiên phí tiện ích/hoa hồng đặt sân và kiểm chứng willingness-to-pay bằng landing page hoặc concierge MVP.
App chỉ có giá trị nếu đạt mật độ người chơi thật.,111/159 có WTP có điều kiện hoặc không chắc chắn; switching trigger 'Có nhiều người chơi thật' xuất hiện nổi bật.,Rủi ro chicken-and-egg lớn hơn rủi ro tính năng.,Launch theo cụm nhỏ: một vài trường/khu vực/môn thể thao trước khi mở rộng toàn thành phố.
Vấn đề tin tưởng là rào cản nền tảng khi ghép người lạ.,"Trust-factor table cho thấy hồ sơ, đánh giá, xác minh, trình độ và nhóm chat đều xuất hiện lặp lại.",Ghép lịch và trình độ chưa đủ; thiếu trust sẽ làm giảm conversion sang buổi chơi thật.,"MVP phải có hồ sơ cơ bản, review sau buổi chơi, xác minh số điện thoại và chat trước buổi chơi."
Đặt sân là pain point có thể kiếm tiền hơn cộng đồng thuần túy.,106/159 cần đặt sân/tìm địa điểm ít nhất thỉnh thoảng; paid-feature table có tín hiệu phí đặt sân/địa điểm tiện lợi cao.,Booking tạo giao dịch rõ ràng và dễ justify fee hơn tính năng cộng đồng.,"Ưu tiên dữ liệu sân, lịch trống, giá, đánh giá sân và quy trình đặt/giữ chỗ."
Mẫu khảo sát rất lệch về sinh viên 18-22.,147/159 ở nhóm 18-22 và 140/159 là học sinh/sinh viên.,"Kết quả phù hợp để chọn beachhead segment, không đủ để khẳng định đại diện toàn bộ người chơi thể thao tại TP.HCM.",Báo cáo demand là promising trong nhóm trẻ/sinh viên; validation tiếp theo cần mẫu người đi làm và người đặt sân thường xuyên.
